notebooks/second_fit.json

{"accuracy": [0.892890989780426, 0.900473952293396, 0.8943127989768982, 0.8947867155075073, 0.9109004735946655, 0.9199051856994629, 0.9165876507759094, 0.9251185059547424, 0.9270142316818237, 0.935545027256012, 0.9298577904701233, 0.9379146695137024, 0.9407582879066467, 0.9436019062995911, 0.9511848092079163], "auc": [0.960192084312439, 0.9642833471298218, 0.9671242833137512, 0.9672685265541077, 0.9724807739257812, 0.9746626615524292, 0.9764328598976135, 0.9781935214996338, 0.9817323684692383, 0.9837009310722351, 0.9828158020973206, 0.9842596054077148, 0.986220121383667, 0.9885321855545044, 0.9899722337722778], "false_negatives": [99.0, 108.0, 112.0, 110.0, 93.0, 85.0, 89.0, 75.0, 78.0, 64.0, 71.0, 62.0, 65.0, 58.0, 51.0], "false_positives": [127.0, 102.0, 111.0, 112.0, 95.0, 84.0, 87.0, 83.0, 76.0, 72.0, 77.0, 69.0, 60.0, 61.0, 52.0], "loss": [0.25738805532455444, 0.24388344585895538, 0.23418103158473969, 0.23240748047828674, 0.21558697521686554, 0.20728637278079987, 0.2017258256673813, 0.1936030387878418, 0.1794353425502777, 0.17046159505844116, 0.1739923506975174, 0.16797178983688354, 0.1585369110107422, 0.14877505600452423, 0.13915720582008362], "precision": [0.8730000257492065, 0.8944099545478821, 0.8856848478317261, 0.8850102424621582, 0.9024640917778015, 0.9134912490844727, 0.9103092551231384, 0.9153061509132385, 0.9216494560241699, 0.9265305995941162, 0.9212678670883179, 0.9295198917388916, 0.93795245885849, 0.9374359250068665, 0.9465570449829102], "recall": [0.8981481194496155, 0.8888888955116272, 0.8847736716270447, 0.8868312835693359, 0.904321014881134, 0.9125514626502991, 0.9084362387657166, 0.9228395223617554, 0.9197530746459961, 0.9341563582420349, 0.9269547462463379, 0.9362139701843262, 0.9331275820732117, 0.9403291940689087, 0.9475308656692505], "true_negatives": [1011.0, 1036.0, 1027.0, 1026.0, 1043.0, 1054.0, 1051.0, 1055.0, 1062.0, 1066.0, 1061.0, 1069.0, 1078.0, 1077.0, 1086.0], "true_positives": [873.0, 864.0, 860.0, 862.0, 879.0, 887.0, 883.0, 897.0, 894.0, 908.0, 901.0, 910.0, 907.0, 914.0, 921.0], "val_accuracy": [0.8633776307106018, 0.8652751445770264, 0.8709677457809448, 0.8709677457809448, 0.8652751445770264, 0.8652751445770264, 0.8614800572395325, 0.8652751445770264, 0.8652751445770264, 0.8728652596473694, 0.8690702319145203, 0.8747628331184387, 0.8747628331184387, 0.8690702319145203, 0.8785578608512878], "val_auc": [0.9432671070098877, 0.9424135088920593, 0.9422516226768494, 0.9422001242637634, 0.9435246586799622, 0.9455923438072205, 0.9445768594741821, 0.9470198154449463, 0.9469683766365051, 0.9468874335289001, 0.9474834203720093, 0.9472112059593201, 0.9474024772644043, 0.9467254877090454, 0.9495290517807007], "val_false_negatives": [49.0, 42.0, 39.0, 45.0, 37.0, 49.0, 39.0, 30.0, 37.0, 42.0, 23.0, 44.0, 42.0, 34.0, 43.0], "val_false_positives": [23.0, 29.0, 29.0, 23.0, 34.0, 22.0, 34.0, 41.0, 34.0, 25.0, 46.0, 22.0, 24.0, 35.0, 21.0], "val_loss": [0.311300665140152, 0.30637598037719727, 0.30597686767578125, 0.3111744523048401, 0.3040017783641815, 0.3089982569217682, 0.30188608169555664, 0.30415692925453186, 0.29404762387275696, 0.30797383189201355, 0.31655821204185486, 0.307874470949173, 0.3059118986129761, 0.3087211847305298, 0.3019969165325165], "val_precision": [0.8844221234321594, 0.8632075190544128, 0.8651162981987, 0.8866994976997375, 0.8468468189239502, 0.8888888955116272, 0.8454545736312866, 0.8262711763381958, 0.8468468189239502, 0.879807710647583, 0.8145161271095276, 0.8916256427764893, 0.8840579986572266, 0.8451327681541443, 0.8965517282485962], "val_recall": [0.7822222113609314, 0.8133333325386047, 0.8266666531562805, 0.800000011920929, 0.8355555534362793, 0.7822222113609314, 0.8266666531562805, 0.8666666746139526, 0.8355555534362793, 0.8133333325386047, 0.897777795791626, 0.804444432258606, 0.8133333325386047, 0.8488888740539551, 0.8088889122009277], "val_true_negatives": [279.0, 273.0, 273.0, 279.0, 268.0, 280.0, 268.0, 261.0, 268.0, 277.0, 256.0, 280.0, 278.0, 267.0, 281.0], "val_true_positives": [176.0, 183.0, 186.0, 180.0, 188.0, 176.0, 186.0, 195.0, 188.0, 183.0, 202.0, 181.0, 183.0, 191.0, 182.0]}

README.md

## Results

accuracy             | 0.9512 | 0.8786
precision            | 0.9466 | 0.8966
recall               | 0.9475 | 0.8089
auc                  | 0.9900 | 0.9495
true_positives       | 921    | 182
true_negatives       | 1086   | 281
false_positives      | 52     | 21
false_negatives      | 51     | 43
f1_score             | 0.9470 | 0.8505